Language,Description
VHDL,"VHDL (VHSIC Hardware Description Language) is a hardware description language used for designing digital circuits and systems. It enables engineers to model and simulate the behavior of electronic systems, and it is commonly employed in the design and verification of complex integrated circuits, FPGA (Field-Programmable Gate Array) configurations, and other digital hardware."
Svelte,"Svelte a JavaScript framework designed for building user interfaces. It shifts the work traditionally done in the browser to a build step, resulting in smaller and more efficient runtime code, and is used for creating fast and reactive web applications with a focus on simplicity and performance."
Arduino,"Arduino refers to both a popular open-source electronics platform and the programming language used to develop software for it. The language is a simplified variant of C/C++, and Arduino is commonly used by hobbyists, students, and professionals to prototype and create a wide range of electronic projects, from simple gadgets to complex interactive systems."
GCC Machine Description,GCC Machine Description refers to a component of the GNU Compiler Collection (GCC) that defines the instruction set and architecture-specific details for various processors. It is written in a specialized language and is crucial for enabling the GCC compiler to generate machine code optimized for specific hardware architectures during the compilation process.
ShaderLab,"ShaderLab is a domain-specific language used in Unity, a game development engine, to define shaders for rendering graphics and visual effects. It simplifies the process of creating and customizing shaders by providing a higher-level, artist-friendly syntax, and it is widely employed in game development to achieve specific visual styles and effects."
MDX,"MDX, or Multidimensional Expressions, is a query language used for retrieving and analyzing data from multidimensional databases, particularly in the context of Microsoft SQL Server Analysis Services (SSAS). It enables users to interact with and extract information from OLAP (Online Analytical Processing) cubes, making it a key tool for business intelligence and data analysis in data warehousing environments."
Eagle,"Eagle refers to a PCB (Printed Circuit Board) design software developed by Autodesk. It is used for designing and creating schematics and layouts for electronic circuits, making it a valuable tool in the field of electronics and electrical engineering."
ZenScript,ZenScript is a powerful scripting language designed for the CraftTweaker mod development platform in Minecraft. It allows users to modify and extend Minecraft gameplay through features like adding new recipes and creating custom mechanics.
Starlark,"Starlark is a domain-specific language designed for configuration files and build configuration, often used in projects like Bazel, a build and test tool developed by Google. It is simple, with a focus on readability, and allows developers to express build rules and configurations in a concise and maintainable way."
RAML,"RAML, or RESTful API Modeling Language, is a YAML-based language for describing the structure of web APIs in a human-readable format. It is used to document and define RESTful APIs, facilitating communication and collaboration between developers, and is often employed in API design and development processes."
Smalltalk,"Smalltalk is an object-oriented, dynamically typed programming language known for its simplicity and interactive development environment. Originally designed for educational purposes, it has been influential in the development of graphical user interfaces and remains in use for various applications, including educational tools and niche software development projects."
Vim script,"Vim script is a scripting language used for customizing and extending the functionality of the Vim text editor. It allows users to create plugins, define key mappings, and automate tasks, enhancing the efficiency and personalization of the text editing experience in Vim."
q,"q is a programming language specifically designed for handling and analyzing large datasets in financial environments, developed by Kx Systems. It excels in time-series data processing and is commonly used in finance and related industries for tasks such as algorithmic trading, risk management, and market analysis."
YARA,YARA is a pattern matching language used for writing custom rules to identify and classify malware or other threats in files or data streams. It is often employed in cybersecurity and digital forensics for creating signatures and rulesets to detect specific patterns associated with malicious software.
Logos,"Logos is a domain-specific language used for writing custom compilers in the Apple ecosystem, primarily for iOS and macOS development. It enables developers to define syntax, semantic analysis, and code generation rules for creating specialized compilers that integrate seamlessly with Apple's Xcode development environment."
PLSQL,"PL/SQL (Procedural Language/Structured Query Language) is a programming language designed for managing and manipulating relational databases in the Oracle Database management system. It is widely used for creating stored procedures, triggers, functions, and other database-centric operations, allowing developers to efficiently work with Oracle databases."
Visual Basic,"Visual Basic (VB) is an event-driven programming language developed by Microsoft. It is widely used for building Windows applications with graphical user interfaces and is known for its simplicity, making it accessible for beginners in software development."
Processing,"Processing is both a programming language and an integrated development environment (IDE) designed for creative coding and visual arts projects. Built on top of Java, it simplifies complex programming concepts, making it accessible for artists and designers to create interactive and visual applications, simulations, and installations."
RouterOS Script,"RouterOS Script refers to the scripting language used in MikroTik's RouterOS operating system, commonly employed in MikroTik routers and networking devices. It allows network administrators to automate various tasks, configure network settings, and implement custom functionalities within RouterOS, enhancing the efficiency of network management and customization."
EJS,"EJS (Embedded JavaScript) is a templating language that allows JavaScript code to be embedded within HTML markup. It is often used in web development to dynamically generate HTML content on the server side, facilitating the creation of dynamic and data-driven web pages."
Coq,"Coq is an interactive proof assistant and a formal language for specifying mathematical theories and reasoning about their correctness. It is primarily used in the field of formal verification for software and hardware systems, ensuring the correctness of mathematical proofs and aiding in the development of reliable and secure software."
SWIG,"SWIG (Simplified Wrapper and Interface Generator) is a tool that connects programs written in C and C++ with a variety of high-level programming languages, including Python, Java, and Ruby. It simplifies the process of creating language bindings, allowing developers to use functionalities from C and C++ in other languages, facilitating cross-language interoperability in software development."
AutoIt,"AutoIt is a scripting language designed for automating the Windows GUI and general scripting tasks. It is often used for creating automation scripts, including automating repetitive tasks, GUI testing, and creating simple desktop applications on the Windows platform."
LLVM,"LLVM (Low Level Virtual Machine) is a compiler infrastructure that provides a collection of reusable compiler and toolchain components for various programming languages. It is widely used as the backend for many programming languages and enables the optimization, compilation, and execution of code for diverse platforms, fostering the development of efficient and performant software."
Visual Basic .NET,"Visual Basic .NET (VB.NET) is an object-oriented programming language developed by Microsoft. It is used for building Windows applications, web applications, and web services, providing developers with a versatile tool for creating a wide range of software applications with a focus on ease of development and integration with the .NET Framework."
FLUX,"Flux is a functional and data-driven scripting language designed for querying, analyzing, and processing data in the context of time-series databases. It is notably used with InfluxDB, a time-series database, and allows users to express complex data transformations and analyses for monitoring and observability purposes."
Nix,"Nix is a purely functional package manager and a domain-specific language for describing software build processes and configurations. It is designed for creating reproducible and declarative system environments, making it particularly useful for managing dependencies and ensuring consistent software builds across different platforms."
Cython,"Cython is a programming language that makes it easy to write C extensions for Python. It allows developers to combine the ease of Python development with the performance benefits of compiled C code, making it useful for optimizing and speeding up certain parts of Python programs."
Zig,"Zig is a statically typed programming language that focuses on performance, safety, and ease of use. It aims to provide low-level control similar to C and C++ while offering modern language features, making it suitable for systems programming, game development, and other performance-critical applications."
GDScript,"GDScript is a scripting language designed for use with the Godot game engine. It is dynamically typed and specifically tailored for game development, providing an easy-to-learn syntax and seamless integration with the Godot engine's functionality for building 2D and 3D games."
Apex,"Apex is a strongly-typed, object-oriented programming language developed by Salesforce.com for building applications on the Salesforce platform. It is designed to facilitate the development of custom functionality within the Salesforce ecosystem, including triggers, controllers, and other server-side components for managing and automating business processes."
SQL,"SQL (Structured Query Language) is a domain-specific language used for managing and manipulating relational databases. It is employed to query, update, and modify data in databases, providing a standardized way to interact with and retrieve information from structured data sets."
Mathematica,"Mathematica is a symbolic computation system that uses a proprietary programming language called Wolfram Language. It is widely used for symbolic mathematics, data analysis, visualization, and general computation, providing a versatile platform for scientific and technical computing."
Bicep,"Bicep is a domain-specific language for defining and deploying Azure Resource Manager (ARM) templates. It is designed to simplify and enhance the authoring experience for Azure infrastructure as code, allowing users to express their infrastructure requirements more concisely and efficiently."
FreeBasic,"FreeBASIC is a high-level, open-source programming language that is based on the BASIC programming language with additional features. It is designed for creating Windows and console applications, focusing on ease of use and fast development, while also providing low-level access for more advanced programmers."
AL,"AL (Application Language) is a programming language used for developing extensions in Microsoft Dynamics 365 Business Central, an enterprise resource planning (ERP) solution. It is designed for building customized business applications and automating processes within the Business Central environment, providing developers with the tools to tailor the ERP system to specific organizational needs."
Verilog,"Verilog is a hardware description language used to model and simulate digital circuits. It is primarily employed in the design and verification of electronic systems, enabling engineers to describe the behavior and structure of digital circuits before their physical implementation in hardware."
YAML,"YAML is a human-readable data serialization format often used for configuration files and data exchange between languages with different data structures. It is commonly utilized in configuration files for applications, infrastructure as code (IaC), and other scenarios where human-friendly data representation is important."
Emacs Lisp,"Emacs Lisp, also known as Elisp, is a programming language specifically designed for extending and customizing the Emacs text editor. It serves as the scripting language for Emacs, allowing users to write custom functions, automate tasks, and modify the behavior of Emacs to suit their preferences."
Standard ML,Standard ML (SML) is a statically-typed functional programming language with a strong emphasis on type safety and expressiveness. It is commonly used in academic and research settings for teaching programming language concepts and for developing compiler and theorem proving tools.
MQL4,MQL4 (MetaQuotes Language 4) is a programming language designed for developing custom trading algorithms (Expert Advisors) and technical indicators in the MetaTrader 4 trading platform. It is used by traders and developers to create automated trading strategies and analyze financial markets within the MetaTrader ecosystem.
OpenEdge ABLa,"OpenEdge ABL (Advanced Business Language) is a business application development language designed for building enterprise-level software solutions. It is commonly used in the Progress OpenEdge platform for developing robust and scalable business applications, with a focus on database interaction, application logic, and user interface development."
GLSL,"GLSL (OpenGL Shading Language) is a C-like language used for programming shaders, which are small programs executed on the GPU (Graphics Processing Unit) to control the rendering pipeline in graphics applications. It is commonly employed in graphics programming, particularly within the OpenGL and Vulkan frameworks, to create visual effects, shaders, and realistic rendering in computer graphics."
TSQL,"T-SQL (Transact-SQL) is a proprietary extension of SQL (Structured Query Language) used by Microsoft SQL Server and Sybase ASE databases. It is employed for querying, updating, and managing relational databases, allowing developers and database administrators to interact with and manipulate data in Microsoft's SQL Server ecosystem."
Smali,"Smali is a low-level assembly-like language used for programming Android applications. It is primarily used for reverse engineering and modifying Android app bytecode, providing a way to inspect and modify the behavior of Android applications at the assembly level."
Astro,"Astro is a modern JavaScript framework specifically designed for crafting static websites. It stands out for its speed, lightweight nature, and ease of use, employing a unique component-based approach to rendering web pages for enhanced performance."
ApacheConf,"ApacheConf typically refers to configuration files for the Apache HTTP Server, written in a syntax that defines how the server behaves. These configuration files, often named httpd.conf, are used to customize the behavior of the Apache web server, specifying settings such as virtual hosts, access control, and other server-related parameters."
ASL,"ASL (AppleScript) is a scripting language developed by Apple for automating tasks and controlling applications on macOS. It allows users to create scripts to automate repetitive actions, manipulate files, and interact with various applications on the Mac platform."
Blade,"Blade is a templating engine for the Laravel PHP framework, providing a syntax for embedding PHP code into views. It simplifies the process of creating dynamic and reusable web pages in Laravel applications, enhancing the separation of concerns between the application's logic and presentation layer."
Modelica,"Modelica is a declarative, equation-based modeling language used for describing the behavior of complex physical systems. It is commonly employed in the fields of engineering and physics for simulation and modeling of dynamic systems, enabling the representation of multidomain physical interactions in a modular and reusable manner."
SystemVerilog,"SystemVerilog is a hardware description and verification language used in the design and verification of digital systems. It extends the capabilities of Verilog, providing features for design, simulation, and testbench development, making it a widely used language in the field of electronic design automation (EDA) for designing and verifying complex digital systems."
FreeMarker,"FreeMarker is a template engine written in Java that is used for generating dynamic content in various applications, especially web applications. It enables the separation of presentation logic from application logic by allowing developers to create templates that define the structure of the final output, which can be dynamically populated with data."
Smarty,"Smarty is a template engine for PHP, designed to simplify the separation of application logic and presentation in web development. It provides a template language that allows developers to embed logic and variables within HTML templates, facilitating the creation of dynamic and maintainable web pages."
Fortran,"Fortran, short for Formula Translation, is a procedural programming language primarily designed for scientific and engineering applications. It is widely used for numerical and scientific computing, especially in fields such as weather modeling, computational physics, and high-performance computing due to its efficiency in handling mathematical computations."
PLpgSQL,"PL/pgSQL is a procedural programming language specifically designed for use with the PostgreSQL database management system. It enables the creation of stored procedures and functions within the database, facilitating complex data manipulation, business logic implementation, and enhancing the overall performance of database operations."
Nginx,"Nginx is a high-performance, open-source web server and reverse proxy server software. Written in C, it is designed to efficiently handle concurrent connections and serve as a front-end for various web applications, improving web server performance and scalability."
M,"""M"" typically refers to the programming language used in Power Query, a data connectivity and preparation tool from Microsoft. It is a functional language primarily used for transforming and cleaning data within the Power BI, Excel, and other Microsoft data-related applications."
VimL,"VimL, short for Vimscript, is a scripting language specifically created for configuring and extending the Vim text editor. It is used to customize Vim's behavior, define key mappings, and create plugins to enhance the functionality of Vim for text editing and programming tasks."
NASL,"NASL, or Nessus Attack Scripting Language, is a domain-specific scripting language used for writing security checks in the Nessus vulnerability scanner. It enables security professionals to define and execute custom vulnerability assessments, helping to identify and address security issues in networked systems and applications."
Macaulay2,"Macaulay2 is a computer algebra system designed for algebraic geometry and commutative algebra. It is written in C++ and provides a powerful environment for mathematical computations, particularly in areas related to algebraic geometry, polynomial computations, and commutative algebra research."
Twig,"Twig is a template engine for the PHP programming language used for creating dynamic web content. It provides a syntax for embedding dynamic content in templates, facilitating the separation of logic and presentation in web applications."
Nextflow,"Nextflow is a domain-specific language (DSL) and a workflow management system designed for the definition and execution of computational workflows, particularly in bioinformatics and scientific research. It simplifies the orchestration of complex and distributed processes, allowing researchers to define and execute data analysis pipelines efficiently."
XSLT,"XSLT, or Extensible Stylesheet Language Transformations, is a declarative, XML-based language used for transforming and styling XML documents. It enables the conversion of XML data into various formats and is commonly employed in web development and data integration to process and present structured information."
AppleScript,"AppleScript is a scripting language developed by Apple for automating tasks and controlling applications on macOS. It allows users to write scripts to manipulate and interact with various system components, applications, and services, providing automation capabilities for tasks ranging from file management to complex workflows."
Valve Data Format,"Valve Data Format (VDF) is a simple key-value pair data interchange format developed by Valve Corporation. It is commonly used in the video game industry for configuration files, data exchange between game components, and representing structured information in various Valve game-related contexts."
Puppet,Puppet is an open-source configuration management tool that uses a declarative language to automate the provisioning and management of IT infrastructure. It is widely used for orchestrating the deployment and maintenance of software and system configurations across diverse computing environments.
Xtend,"Xtend is a statically-typed programming language designed to improve upon Java by providing concise syntax, enhanced features, and improved readability. It is often used in conjunction with Java and compiles to Java source code, offering developers a more expressive and streamlined language for building applications on the Java Virtual Machine (JVM)."
OpenSCAD,"OpenSCAD is a script-based, declarative 3D modeling language used for creating 3D models and designs. It allows users to describe objects through code, enabling parametric modeling and precise control over geometric shapes for 3D printing and computer-aided design (CAD) applications."
Ada,"Ada is a high-level, statically-typed programming language designed for developing large and complex systems with a focus on safety and reliability. It is often used in critical systems such as aerospace, military, and healthcare applications where the emphasis is on producing robust and fault-tolerant software."
Haxe,"Haxe is a high-level, cross-platform programming language that can be transpiled into various target languages, including JavaScript, C++, and more. It is used for developing multi-platform applications, games, and interactive content, providing a versatile and efficient solution for code sharing across different platforms."
Groff,"Groff, or the GNU Troff, is a typesetting system that processes plain text with markup commands to produce formatted documents. It is often used for creating various types of documents, including manuals, books, and technical reports, primarily in Unix and Unix-like operating systems."
Gherkin,"Gherkin is a business-readable language for writing test scenarios in behavior-driven development (BDD), promoting collaboration between technical and non-technical stakeholders. It is commonly used with tools like Cucumber to describe and automate software behavior."
Racket,"Racket is a versatile, multi-paradigm programming language used for teaching, domain-specific language development, and various applications. It supports functional, imperative, and object-oriented programming styles."
Ren'Py,"Ren'Py is a visual novel engine that utilizes its own scripting language for game development, specifically designed for creating interactive storytelling experiences. It simplifies the process of developing visual novels, allowing creators to focus on narrative design and character interactions."
Idris,"Idris is a functional programming language with dependent types, allowing precise program specifications. It is employed for writing reliable software, especially in safety-critical applications and formal verification."
RobotFramework,Robot Framework is an open-source test automation framework using a keyword-driven approach for BDD and ATDD. It simplifies test case definition with a tabular syntax and is commonly used for automating software testing.
Yacc,"Yacc, or Yet Another Compiler Compiler, is a tool for generating parsers that can process syntax according to a specified formal grammar. It is frequently used in compiler construction to implement syntax analysis for programming languages."
